[
{"code": "PL", "flag": "🇵🇱", "names": ["Polska"], "capitals": ["Warszawa"], "continent": "europe"},
{"code": "DE", "flag": "🇩🇪", "names": ["Niemcy"], "capitals": ["Berlin"], "continent": "europe"},
{"code": "FR", "flag": "🇫🇷", "names": ["Francja"], "capitals": ["Paryż"], "continent": "europe"},
{"code": "ES", "flag": "🇪🇸", "names": ["Hiszpania"], "capitals": ["Madryt"], "continent": "europe"},
{"code": "IT", "flag": "🇮🇹", "names": ["Włochy", "Wlochy"], "capitals": ["Rzym"], "continent": "europe"},
{"code": "GB", "flag": "🇬🇧", "names": ["Wielka Brytania", "Zjednoczone Królestwo", "UK"], "capitals": ["Londyn"], "continent": "europe"},
{"code": "US", "flag": "🇺🇸", "names": ["Stany Zjednoczone", "USA", "Stany Zjednoczone Ameryki"], "capitals": ["Waszyngton"], "continent": "north-america"},
{"code": "BR", "flag": "🇧🇷", "names": ["Brazylia"], "capitals": ["Brasília", "Brasilia"], "continent": "south-america"},
{"code": "CA", "flag": "🇨🇦", "names": ["Kanada"], "capitals": ["Ottawa"], "continent": "north-america"},
{"code": "JP", "flag": "🇯🇵", "names": ["Japonia"], "capitals": ["Tokio"], "continent": "asia"},
{"code": "CN", "flag": "🇨🇳", "names": ["Chiny"], "capitals": ["Pekin"], "continent": "asia"},
{"code": "RU", "flag": "🇷🇺", "names": ["Rosja"], "capitals": ["Moskwa"], "continent": "europe"},
{"code": "IN", "flag": "🇮🇳", "names": ["Indie"], "capitals": ["Nowe Delhi"], "continent": "asia"},
{"code": "AU", "flag": "🇦🇺", "names": ["Australia"], "capitals": ["Canberra"]},
{"code": "MX", "flag": "🇲🇽", "names": ["Meksyk"], "capitals": ["Meksyk"], "continent": "north-america"},
{"code": "ZA", "flag": "🇿🇦", "names": ["Republika Południowej Afryki", "Republika Poludniowej Afryki", "RPA", "Poludniowa Afryka"], "capitals": ["Pretoria", "Kapsztad", "Bloemfontein"], "continent": "africa"},
{"code": "SE", "flag": "🇸🇪", "names": ["Szwecja"], "capitals": ["Sztokholm"], "continent": "europe"},
{"code": "NL", "flag": "🇳🇱", "names": ["Holandia", "Niderlandy"], "capitals": ["Amsterdam"], "continent": "europe"},
{"code": "AR", "flag": "🇦🇷", "names": ["Argentyna"], "capitals": ["Buenos Aires"], "continent": "south-america"},
{"code": "CH", "flag": "🇨🇭", "names": ["Szwajcaria"], "capitals": ["Berno"], "continent": "europe"},
{"code": "NO", "flag": "🇳🇴", "names": ["Norwegia"], "capitals": ["Oslo"], "continent": "europe"},
{"code": "FI", "flag": "🇫🇮", "names": ["Finlandia"], "capitals": ["Helsinki"], "continent": "europe"},
{"code": "DK", "flag": "🇩🇰", "names": ["Dania"], "capitals": ["Kopenhaga"], "continent": "europe"},
{"code": "BE", "flag": "🇧🇪", "names": ["Belgia"], "capitals": ["Bruksela"], "continent": "europe"},
{"code": "PT", "flag": "🇵🇹", "names": ["Portugalia"], "capitals": ["Lizbona"], "continent": "europe"},
{"code": "GR", "flag": "🇬🇷", "names": ["Grecja"], "capitals": ["Ateny"], "continent": "europe"},
{"code": "TR", "flag": "🇹🇷", "names": ["Turcja"], "capitals": ["Ankara"], "continent": "europe"},
{"code": "SA", "flag": "🇸🇦", "names": ["Arabia Saudyjska"], "capitals": ["Rijad"], "continent": "asia"},
{"code": "AE", "flag": "🇦🇪", "names": ["Zjednoczone Emiraty Arabskie", "ZEA"], "capitals": ["Abu Zabi"], "continent": "asia"},
{"code": "IL", "flag": "🇮🇱", "names": ["Izrael"], "capitals": ["Jerozolima"], "continent": "asia"},
{"code": "EG", "flag": "🇪🇬", "names": ["Egipt"], "capitals": ["Kair"], "continent": "africa"},
{"code": "NG", "flag": "🇳🇬", "names": ["Nigeria"], "capitals": ["Abudża", "Abudza"], "continent": "africa"},
{"code": "KE", "flag": "🇰🇪", "names": ["Kenia"], "capitals": ["Nairobi"], "continent": "africa"},
{"code": "MA", "flag": "🇲🇦", "names": ["Maroko"], "capitals": ["Rabat"], "continent": "africa"},
{"code": "DZ", "flag": "🇩🇿", "names": ["Algieria"], "capitals": ["Algier"], "continent": "africa"},
{"code": "CL", "flag": "🇨🇱", "names": ["Chile"], "capitals": ["Santiago"], "continent": "south-america"},
{"code": "PE", "flag": "🇵🇪", "names": ["Peru"], "capitals": ["Lima"], "continent": "south-america"},
{"code": "CO", "flag": "🇨🇴", "names": ["Kolumbia"], "capitals": ["Bogota"], "continent": "south-america"},
{"code": "VE", "flag": "🇻🇪", "names": ["Wenezuela"], "capitals": ["Caracas"], "continent": "south-america"},
{"code": "KR", "flag": "🇰🇷", "names": ["Korea Południowa", "Korea Poludniowa"], "capitals": ["Seul"], "continent": "asia"},
{"code": "ID", "flag": "🇮🇩", "names": ["Indonezja"], "capitals": ["Dżakarta"], "continent": "asia"},
{"code": "PH", "flag": "🇵🇭", "names": ["Filipiny"], "capitals": ["Manila"], "continent": "asia"},
{"code": "TH", "flag": "🇹🇭", "names": ["Tajlandia"], "capitals": ["Bangkok"], "continent": "asia"},
{"code": "VN", "flag": "🇻🇳", "names": ["Wietnam"], "capitals": ["Hanoi"], "continent": "asia"},
{"code": "PK", "flag": "🇵🇰", "names": ["Pakistan"], "capitals": ["Islamabad"], "continent": "asia"},
{"code": "BD", "flag": "🇧🇩", "names": ["Bangladesz"], "capitals": ["Dhaka"], "continent": "asia"},
{"code": "IR", "flag": "🇮🇷", "names": ["Iran"], "capitals": ["Teheran"], "continent": "asia"},
{"code": "IQ", "flag": "🇮🇶", "names": ["Irak"], "capitals": ["Bagdad"], "continent": "asia"},
{"code": "HU", "flag": "🇭🇺", "names": ["Węgry", "Wegry"], "capitals": ["Budapeszt"], "continent": "europe"},
{"code": "CZ", "flag": "🇨🇿", "names": ["Czechy"], "capitals": ["Praga"], "continent": "europe"},
{"code": "SK", "flag": "🇸🇰", "names": ["Słowacja", "Slowacja"], "capitals": ["Bratysława"], "continent": "europe"},
{"code": "RO", "flag": "🇷🇴", "names": ["Rumunia"], "capitals": ["Bukareszt"], "continent": "europe"},
{"code": "BG", "flag": "🇧🇬", "names": ["Bułgaria", "Bulgaria"], "capitals": ["Sofia"], "continent": "europe"},
{"code": "RS", "flag": "🇷🇸", "names": ["Serbia"], "capitals": ["Belgrad"], "continent": "europe"},
{"code": "HR", "flag": "🇭🇷", "names": ["Chorwacja"], "capitals": ["Zagrzeb"], "continent": "europe"},
{"code": "SI", "flag": "🇸🇮", "names": ["Słowenia", "Slowenia"], "capitals": ["Lublana"], "continent": "europe"},
{"code": "BA", "flag": "🇧🇦", "names": ["Bośnia i Hercegowina", "Bośnia", "Bosnia"], "capitals": ["Sarajewo"], "continent": "europe"},
{"code": "UA", "flag": "🇺🇦", "names": ["Ukraina"], "capitals": ["Kijów"], "continent": "europe"},
{"code": "BY", "flag": "🇧🇾", "names": ["Białoruś", "Bialorus"], "capitals": ["Mińsk"], "continent": "europe"},
{"code": "NZ", "flag": "🇳🇿", "names": ["Nowa Zelandia", "NowaZelandia"], "capitals": ["Wellington"]},
{"code": "IS", "flag": "🇮🇸", "names": ["Islandia"], "capitals": ["Reykjavik"], "continent": "europe"},
{"code": "MT", "flag": "🇲🇹", "names": ["Malta"], "capitals": ["Valletta"], "continent": "europe"},
{"code": "LU", "flag": "🇱🇺", "names": ["Luksemburg"], "capitals": ["Luksemburg"], "continent": "europe"},
{"code": "SG", "flag": "🇸🇬", "names": ["Singapur"], "capitals": ["Singapur"], "continent": "asia"},
{"code": "TW", "flag": "🇹🇼", "names": ["Tajwan", "Tajwan(Republika)"], "capitals": ["Tajpej"], "continent": "asia"},
{"code": "HK", "flag": "🇭🇰", "names": ["Hongkong", "Hong Kong"], "capitals": ["Hongkong"], "continent": "asia"},
{"code": "SY", "flag": "🇸🇾", "names": ["Syria"], "capitals": ["Damaszek"], "continent": "asia"},
{"code": "LB", "flag": "🇱🇧", "names": ["Liban"], "capitals": ["Bejrut"], "continent": "asia"},
{"code": "JO", "flag": "🇯🇴", "names": ["Jordania"], "capitals": ["Amman"], "continent": "asia"},
{"code": "MD", "flag": "🇲🇩", "names": ["Mołdawia", "Moldawia", "Moldowa"], "capitals": ["Kiszyniów"], "continent": "europe"},
{"code": "KZ", "flag": "🇰🇿", "names": ["Kazachstan"], "capitals": ["Astana"], "continent": "asia"},
{"code": "UZ", "flag": "🇺🇿", "names": ["Uzbekistan"], "capitals": ["Taszkent"], "continent": "asia"},
{"code": "AZ", "flag": "🇦🇿", "names": ["Azerbejdżan", "Azerbejdzan"], "capitals": ["Baku"], "continent": "europe"},
{"code": "GE", "flag": "🇬🇪", "names": ["Gruzja"], "capitals": ["Tbilisi"], "continent": "europe"},
{"code": "AM", "flag": "🇦🇲", "names": ["Armenia"], "capitals": ["Erywań"], "continent": "europe"},
{"code": "MN", "flag": "🇲🇳", "names": ["Mongolia"], "capitals": ["Ułan Bator"], "continent": "asia"},
{"code": "NP", "flag": "🇳🇵", "names": ["Nepal"], "capitals": ["Katmandu"], "continent": "asia"},
{"code": "LK", "flag": "🇱🇰", "names": ["Sri Lanka", "SriLanka"], "capitals": ["Kolombo"], "continent": "asia"},
{"code": "MM", "flag": "🇲🇲", "names": ["Mjanma", "Myanmar", "Birma", "Birma (Myanmar)"], "capitals": ["Naypyidaw"], "continent": "asia"},
{"code": "KH", "flag": "🇰🇭", "names": ["Kambodża", "Kambodza"], "capitals": ["Phnom Penh"], "continent": "asia"},
{"code": "LA", "flag": "🇱🇦", "names": ["Laos"], "capitals": ["Wientian"], "continent": "asia"},
{"code": "PY", "flag": "🇵🇾", "names": ["Paragwaj", "Paraguay"], "capitals": ["Asuncion"], "continent": "south-america"},
{"code": "UY", "flag": "🇺🇾", "names": ["Urugwaj"], "capitals": ["Montevideo"], "continent": "south-america"},
{"code": "BO", "flag": "🇧🇴", "names": ["Boliwia"], "capitals": ["La Paz"], "continent": "south-america"},
{"code": "EC", "flag": "🇪🇨", "names": ["Ekwador"], "capitals": ["Quito"], "continent": "south-america"},
{"code": "AO", "flag": "🇦🇴", "names": ["Angola"], "capitals": ["Luanda"], "continent": "africa"},
{"code": "BJ", "flag": "🇧🇯", "names": ["Benin"], "capitals": ["Porto-Novo"], "continent": "africa"},
{"code": "BW", "flag": "🇧🇼", "names": ["Botswana"], "capitals": ["Gaborone"], "continent": "africa"},
{"code": "BF", "flag": "🇧🇫", "names": ["Burkina Faso"], "capitals": ["Wagadugu"], "continent": "africa"},
{"code": "BI", "flag": "🇧🇮", "names": ["Burundi"], "capitals": ["Gitega"], "continent": "africa"},
{"code": "CV", "flag": "🇨🇻", "names": ["Wyspy Zielonego Przylądka", "Wyspy Zielonego Przyladka"], "capitals": ["Praia"], "continent": "africa"},
{"code": "CM", "flag": "🇨🇲", "names": ["Kamerun"], "capitals": ["Jaunde"], "continent": "africa"},
{"code": "CF", "flag": "🇨🇫", "names": ["Republika Środkowoafrykańska", "Republika Srodkowoafrykanska"], "capitals": ["Bangui"], "continent": "africa"},